<?xml version="1.0" encoding="ISO-8859-1"?>
<xs:schema xmlns:xs="http://www.w3.org/2001/XMLSchema">

  <xs:complexType name="emailType">
    <xs:simpleContent>
      <xs:extension base="xs:string">
        <xs:attribute type="xs:string" name="type" use="optional"/>
      </xs:extension>
    </xs:simpleContent>
  </xs:complexType>
  
  <xs:element name="employees">
     <xs:complexType>
      <xs:sequence>
        <xs:element name="employee" maxOccurs="unbounded">
          <xs:complexType>
            <xs:sequence>
              <xs:element name="firstname" type="xs:string"/>
              <xs:element name="lastname" type="xs:string"/>
              <xs:element name="age" type="xs:string"/>
              <xs:element name="email" type="emailType"/>
            </xs:sequence>
            <xs:attribute name="emplid" type="xs:string" />
            <xs:attribute name="type" type="xs:string" />
          </xs:complexType>
        </xs:element>
      </xs:sequence>
    </xs:complexType>
  </xs:element>
 
</xs:schema>